{
  "eventId": "019bd4a1-3f20-7d61-9a08-4b5c6d7e8f90",
  "occurredAt": "2026-09-09T05:14:22.9130000+00:00",
  "aggregateId": "019bd49f-8c11-7b42-85d3-1e2f3a4b5c6d",
  "organisationId": "019bcf7f-9d10-7b21-84c6-5e7f8a9b0c1d",
  "versionNumber": 4,
  "supersededVersionId": "019bd18c-2a73-7e05-9f14-7a8b9c0d1e2f",
  "eventType": "catalog.catalog-version-published.v1",
  "schemaVersion": 1
}
